username;date;retweets;favorites;text;geo;mentions;hashtags;id;permalink
;2019-02-23 00:04;2;1;"นิติศาสตร์ จุฬาฯ จัดเสวนา เวที ฬ.จุฬาฯ นิติมิติ "นโยบายภาษีอากรเพื่อการพัฒนาประเทศ" #เลือกตั้ง62 โดย ผู้แทนจากพรรคการเมือง #ไทยรักษาชาติ #ไทยศรีวิไลย์ #ประชาชาติ #ประชาธิปัตย์ #พลังประชารัฐ #เพื่อไทย #ภูมิใจไทย #รวมพลังประชาชาติไทย #เสรีรวมไทย #อนาคตใหม่ 27 ก.พ. 8.30-12.30น. pic.twitter.com/62lOxclvCI";;;#เล #ไทยร #ไทยศร #ประชาชาต #ประชาธ #พล #เพ #ภ #รวมพล #เสร #อนาคตใหม;"1098991820376203265";https://twitter.com/rapee_cu/status/1098991820376203265
;2019-02-22 22:03;0;0;"หิวเมื่อไหร่ก็แวะมา... #เลือกตั้ง2562 #savethanathorn #รวมพลังประชาชาติไทย pic.twitter.com/9vbgM0EELc";;;#เล #savethanathorn #รวมพล;"1098961450796646400";https://twitter.com/fickout/status/1098961450796646400
;2019-02-22 21:27;25;8;"ไทยรัฐดีเบต+จอมขวัญ นี่คือ เวทีตัดสินนักการเมืองเลยนะ ถ้าทำได้ดีคือแจ้งเกิดเลย แมสเลยจ้า แต่ถ้าทำได้ไม่ดีคือดับแล้วดับเลย ไพบูลย์ เขตรัฐ จักร ดับไปแล้วใครจะเป็นรายต่อไปคะ ปรายตามองไปที่คุณประยึด #ไทยรัฐเลือกตั้ง62 #เลือกตั้ง2562 #รวมพลังประชาชาติไทย";;;#ไทยร #เล #รวมพล;"1098952510016970754";https://twitter.com/Pinny45/status/1098952510016970754
;2019-02-22 20:37;10;2;"ส่งหานังจักษ์5ใบได้ทางช่องทางไหนได้บ้าง? #ไทยรัฐเลือกตั้ง62 #ไทยรัฐดีเบต #เลือกตั้ง62 #รวมพลังประชาชาติไทย pic.twitter.com/EWpJB6awFd";;;#ไทยร #ไทยร #เล #รวมพล;"1098939858490281985";https://twitter.com/hengsuaycountry/status/1098939858490281985
;2019-02-22 19:25;9;12;""พรรคเราไม่เน้นดีเบต พรรคเราเน้นลงมือทำ" รศ.ดร.จักษ์ พันธ์ชูเพชร #รวมพลังประชาชาติไทย สดคลิก https:// bit.ly/2TaAQm2 #ไทยรัฐเลือกตั้ง62 #เลือกตั้ง62 #ไทยรัฐดีเบต pic.twitter.com/mCxupzpaPn";;;#รวมพล #ไทยร #เล #ไทยร;"1098921749641551873";https://twitter.com/Thairath_News/status/1098921749641551873
;2019-02-22 19:05;90;49;"ย้อนชม วิวาทะระหว่าง “รศ.ดร.จักษ์” จาก #รวมพลังประชาชาติไทย และ จตุพร พรหมพันธุ์ จาก #เพื่อชาติ สดคลิก https:// bit.ly/2TaAQm2 #ไทยรัฐเลือกตั้ง62 #เลือกตั้ง62 #ไทยรัฐดีเบต pic.twitter.com/RoGuxrJAis";;;#รวมพล #เพ #ไทยร #เล #ไทยร;"1098916617159766018";https://twitter.com/Thairath_News/status/1098916617159766018
;2019-02-22 18:46;1;1;"#อิหยังวะ ทุกครั้งที่ตัดไปที่จักร5ใบ #ไทยรัฐเลือกตั้ง62 #ไทยรัฐดีเบต #เลือกตั้ง62 #รวมพลังประชาชาติไทย pic.twitter.com/jaP0jK4PHO";;;#อ #ไทยร #ไทยร #เล #รวมพล;"1098911895489146881";https://twitter.com/hengsuaycountry/status/1098911895489146881
;2019-02-22 18:40;487;108;"GU ASK REAL EDOK JAK 5 PARINYAS? "คำว่ารัฐประหาร ไม่ใช่เผด็จการ" ตำราบ้านพ่องมึงเหรอ เผด็จการแบ่งเป็น2ประเภท เผด็จการรัฐสภา กับเผด็จการทหาร อิหยังวะ???? #จักร5ใบ #ไทยรัฐเลือกตั้ง62 #ไทยรัฐดีเบต #เลือกตั้ง62 #รวมพลังประชาชาติไทย pic.twitter.com/G830ocMhS5";;;#จ #ไทยร #ไทยร #เล #รวมพล;"1098910386835775488";https://twitter.com/hengsuaycountry/status/1098910386835775488
;2019-02-22 17:08;2;5;"ยื่นยุบ 12 พรรคการเมือง ชี้ ทำผิดกฎหมายเลือกตั้ง นำโดย #รวมพลังประชาชาติไทย http:// hilight.kapook.com/view/184318 #เลือกตั้ง62 #เลือกตั้ง2562 #ข่าววันนี้ #kapook";;;#รวมพล #เล #เล #ข #kapook;"1098887224576233472";https://twitter.com/kapookdotcom/status/1098887224576233472
;2019-02-22 16:39;0;0;"#เลือกตั้ง62 #อนาคตใหม่ #ประชาธิปัตย์ #รวมพลังประชาชาติไทย #เสรีรวมไทย อ่ะ แท็กไว้ก่อนเลย วันนี้ผมขอพูดในฐานะประชาชนที่อยู่ในตัวเมืองสุราษฎร์ฯ (สฎ.เขต 1) มาตั้งแต่เกิด จนถึงปัจจุบัน รวม 16 ปี ที่ผมเจอปัญหามา แต่ก็แก้ไม่ได้ หรือแก้ได้ แต่ไม่สะดวก มีดังนี้ครับ (1)";;;#เล #อนาคตใหม #ประชาธ #รวมพล #เสร;"1098879852826877952";https://twitter.com/airaimairoo/status/1098879852826877952
;2019-02-22 15:39;0;1;"แห่แชร์ภาพผู้สมัคร ส.ส.ดอนเมือง ผมสั้นน่ารัก หนุ่ม ๆ ถึงกับลั่น แทบอยากย้ายบ้าน ! http:// hilight.kapook.com/view/184312 #เลือกตั้ง62 #เลือกตั้ง2562 #รวมพลังประชาชาติไทย #ปอมมี่ #กัญญาภัคปัญญวัต #ข่าววันนี้ #ข่าวการเมือง #kapook";;;#เล #เล #รวมพล #ปอมม #ก #ข #ข #kapook;"1098864907619987456";https://twitter.com/kapookdotcom/status/1098864907619987456
;2019-02-22 15:10;10;3;"#ประชาชนปฏิรูป #เสรีรวมไทย #รวมพลังประชาชาติไทย #เลือกตั้ง62 #เลือกตั้ง2562 #kapook pic.twitter.com/6UaPncPhPv";;;#ประชาชนปฏ #เสร #รวมพล #เล #เล #kapook;"1098857667701878784";https://twitter.com/kapookdotcom/status/1098857667701878784
;2019-02-22 13:40;0;1;"มาอีกแล้ว! ส.ส. สาวสวย เห็นแล้วใจละลาย "ปอมมี่ กัญญาภัค" สาวผมสั้น ตัวเล็ก น่ารัก ยิ้มหวาน แล้วคุณจะหลงรักเธอคนนี้ #ปอมมี่ #ปอมมี่กัญญาภัค #รวมพลังประชาชาติไทย #การเมือง #เลือกตั้ง2562 #ไบรท์ทีวีช่อง20 #Brighttv20 https://www. brighttv.co.th/net-idol/350730";;;#ปอมม #ปอมม #รวมพล #การเม #เล #ไบรท #Brighttv20;"1098834886243151873";https://twitter.com/BrightTV20/status/1098834886243151873
;2019-02-22 10:55;374;104;"แจกลิงค์ ปักหมุดรอ ชมสด #ไทยรัฐดีเบต 18.00 น. 22ก.พ. #ไทยรัฐเลือกตั้ง62 เวทีดีเบต ครั้งที่ 2 ใครตีฐานเสียงภาคเหนือได้สำเร็จ? คลิก >> https://www. facebook.com/thairathtv/vid eos/379804279498912 … #ประชาธิปัตย์ #เพื่อชาติ #เพื่อไทย #อนาคตใหม่ #เสรีรวมไทย #รวมพลังประชาชาติไทย #พลังประชารัฐ #เลือกตั้ง62 #Savethanatorn pic.twitter.com/jzptFxFzfi";;;#ไทยร #ไทยร #ประชาธ #เพ #เพ #อนาคตใหม #เสร #รวมพล #พล #เล #Savethanatorn;"1098793272695173121";https://twitter.com/Thairath_News/status/1098793272695173121
;2019-02-22 10:50;40;27;"อย่าลืม! เย็นนี้เรามีนัดกัน #ไทยรัฐดีเบต #ไทยรัฐเลือกตั้ง62 ใครจะตีฐานเสียงภาคเหนือสำเร็จ? #ประชาธิปัตย์ #เพื่อไทย #เพื่อชาติ #พลังประชารัฐ #รวมพลังประชาชาติไทย #เสรีรวมไทย #อนาคตใหม่ สด 18.00 น. ไทยรัฐทีวี ช่อง 32 FB LIVE #ไทยรัฐ - #ไทยรัฐทีวี #เลือกตั้ง62 #Savethanatorn pic.twitter.com/C40GSGMB4N";;;#ไทยร #ไทยร #ประชาธ #เพ #เพ #พล #รวมพล #เสร #อนาคตใหม #ไทยร #ไทยร #เล #Savethanatorn;"1098792192011694080";https://twitter.com/Thairath_News/status/1098792192011694080
;2019-02-21 21:21;1;0;"พรรคนี้คือ...ทำไมชอบปิดทับป้ายรถเมล์ #รวมพลังประชาชาติไทย pic.twitter.com/NsqQwkEXro";;;#รวมพล;"1098588591758790657";https://twitter.com/Yeolmint/status/1098588591758790657
;2019-02-21 20:48;48;32;"ในระหว่างที่ #Savethanatorn ฟ้าอย่าลืม พรุ่งนี้มีดีเบต จอมขวัญไปรอแล้วที่เชียงใหม่ ถ่ายทอดสด 22 ก.พ. เวลา 18.00 น. #ไทยรัฐเลือกตั้ง62 ใครตีฐานเสียงภาคเหนือสำเร็จ? #ประชาธิปัตย์ #เพื่อไทย #เพื่อชาติ #พลังประชารัฐ #รวมพลังประชาชาติไทย #เสรีรวมไทย #อนาคตใหม่ pic.twitter.com/XqWRyLeUMY";;;#Savethanatorn #ไทยร #ประชาธ #เพ #เพ #พล #รวมพล #เสร #อนาคตใหม;"1098580097957691393";https://twitter.com/Thairath_News/status/1098580097957691393
;2019-02-21 20:28;52;38;"พรุ่งนี้ #จอมขวัญ บุกเชียงใหม่ ตัวพ่อจาก 7 พรรค จะขึ้นเวที #ไทยรัฐดีเบต #ไทยรัฐเลือกตั้ง62 ใครตีฐานเสียงภาคเหนือสำเร็จ? #ประชาธิปัตย์ #เพื่อไทย #เพื่อชาติ #พลังประชารัฐ #รวมพลังประชาชาติไทย #เสรีรวมไทย #อนาคตใหม่ ถ่ายทอดสด ไทยรัฐทีวี ช่อง 32 FB LIVE #ไทยรัฐ - #ไทยรัฐทีวี pic.twitter.com/f8Cy4PSRPN";;;#จอมขว #ไทยร #ไทยร #ประชาธ #เพ #เพ #พล #รวมพล #เสร #อนาคตใหม #ไทยร #ไทยร;"1098575288789721088";https://twitter.com/Thairath_News/status/1098575288789721088
;2019-02-21 19:48;1;0;"ใครจะไปสู้พรรค ลุงตู่ ได้ รัฐประหาร ฉีกรัฐธรรมนูญ เขียนกติกา เลือกกรรมการ และลงแข่งขันเอง #เลือกตั้ง #เลือกตั้ง62 #เลือกตั้ง2562 #เพื่อไทย #พลังประชารัฐ #ประชาธิปัตย์ #ภูมิใจไทย #อนาคตใหม่ #เสรีรวมไทย #รวมพลังประชาชาติไทย #ประเทศกูมี #หนักแผ่นดิน #ThailandElection #สืบทอดอำนาจ https:// twitter.com/Thairath_News/ status/1098560732998729728 …";;;#เล #เล #เล #เพ #พล #ประชาธ #ภ #อนาคตใหม #เสร #รวมพล #ประเทศก #หน #ThailandElection #ส;"1098565133901520896";https://twitter.com/AsimBKK/status/1098565133901520896
;2019-02-21 19:35;0;2;"เท่าที่จำได้ อุดมการณ์ของคุณ ที่หลอกชาวบ้านไปตายคือ "ปฏิรูปก่อนเลือกตั้ง" #เลือกตั้ง #เลือกตั้ง62 #เลือกตั้ง2562 #เพื่อไทย #พลังประชารัฐ #ประชาธิปัตย์ #ภูมิใจไทย #อนาคตใหม่ #เสรีรวมไทย #รวมพลังประชาชาติไทย #ประเทศกูมี #หนักแผ่นดิน #สืบทอดอำนาจ #ประชาธิปไตย #ปฏิรูปก่อนเลือกตั้ง https:// twitter.com/thestandardth/ status/1098560430648131586 …";;;#เล #เล #เล #เพ #พล #ประชาธ #ภ #อนาคตใหม #เสร #รวมพล #ประเทศก #หน #ส #ประชาธ #ปฏ;"1098561731171762179";https://twitter.com/AsimBKK/status/1098561731171762179
;2019-02-21 19:27;0;1;"แต่ผมเชื่อว่า ประชาชน จะสกัดกั้นการสืบทอดอำนาจของท่านแน่นอนครับ #เลือกตั้ง #เลือกตั้ง62 #เลือกตั้ง2562 #เพื่อไทย #พลังประชารัฐ #ประชาธิปัตย์ #ภูมิใจไทย #อนาคตใหม่ #เสรีรวมไทย #รวมพลังประชาชาติไทย #ประเทศกูมี #หนักแผ่นดิน #ThailandElection #Corruption #สืบทอดอำนาจ #ประชาธิปไตย https:// twitter.com/ThaiPBSNews/st atus/1098559141243629568 …";;;#เล #เล #เล #เพ #พล #ประชาธ #ภ #อนาคตใหม #เสร #รวมพล #ประเทศก #หน #ThailandElection #Corruption #ส #ประชาธ;"1098559918494216193";https://twitter.com/AsimBKK/status/1098559918494216193
;2019-02-21 19:22;1;1;"ลูกพี่ ป.ปลา ทั้ง 2คนของท่านนี่แหละครับ "ตัวทำลาย" ความเชื่อมั่น #เลือกตั้ง #เลือกตั้ง62 #เลือกตั้ง2562 #เพื่อไทย #พลังประชารัฐ #ประชาธิปัตย์ #ภูมิใจไทย #อนาคตใหม่ #เสรีรวมไทย #รวมพลังประชาชาติไทย #งบกลาโหม #ปฏิรูปกองทัพ #ประเทศกูมี #หนักแผ่นดิน #ThailandElection #Corruption https:// twitter.com/VoiceOnlineTH/ status/1098557376263639042 …";;;#เล #เล #เล #เพ #พล #ประชาธ #ภ #อนาคตใหม #เสร #รวมพล #งบกลาโหม #ปฏ #ประเทศก #หน #ThailandElection #Corruption;"1098558461044973568";https://twitter.com/AsimBKK/status/1098558461044973568
;2019-02-21 18:55;1;0;"การที่ พล.อ.ประยุทธ์ จันทร์โอชา รับเป็น Candidate นายกรัฐมนตรี ให้พรรคพลังประชารัฐโดยที่ไม่ได้เป็นสมาชิกพรรค เป็นการกระทำที่พวกคุณยอมรับได้หรือไม่ #เลือกตั้ง #เลือกตั้ง62 #เลือกตั้ง2562 #เพื่อไทย #พลังประชารัฐ #ประชาธิปัตย์ #ภูมิใจไทย #อนาคตใหม่ #เสรีรวมไทย #รวมพลังประชาชาติไทย";;;#เล #เล #เล #เพ #พล #ประชาธ #ภ #อนาคตใหม #เสร #รวมพล;"1098551684836470784";https://twitter.com/AsimBKK/status/1098551684836470784
;2019-02-21 18:11;1;0;"งานวันเน้~~~~ #เลือกตั้ง62 #เลือกตั้ง2562 #อนาคตใหม่ #ประชาธิปัตย์ #ภูมิใจไทย #เพื่อไทย #รวมพลังประชาชาติไทย #wewatch @Wewatch6 https:// twitter.com/bkksnow/status /1098535753234038784 …";;@Wewatch6;#เล #เล #อนาคตใหม #ประชาธ #ภ #เพ #รวมพล #wewatch;"1098540646757875712";https://twitter.com/lem_capitain/status/1098540646757875712
;2019-02-21 18:00;0;0;"ในฐานะ Candidate นายกรัฐมนตรี พล.อ.ประยุทธ์ จันทร์โอชา หัวหน้าคณะรัฐประหารและนายกรัฐมนตรี สมควร "ลาออก" จากตำแหน่งทั้ง 2 หรือไม่ #เลือกตั้ง #เลือกตั้ง62 #เลือกตั้ง2562 #เพื่อไทย #พลังประชารัฐ #ประชาธิปัตย์ #ภูมิใจไทย #อนาคตใหม่ #เสรีรวมไทย #รวมพลังประชาชาติไทย #ThailandElection";;;#เล #เล #เล #เพ #พล #ประชาธ #ภ #อนาคตใหม #เสร #รวมพล #ThailandElection;"1098538044657782784";https://twitter.com/AsimBKK/status/1098538044657782784
;2019-02-20 19:44;0;0;""ทุกครั้งที่กันทหารออก เขาก็จะพยานามเข้ามา ทำไมเราไม่ทำให้เขาเข้ามาเลยล่ะครับ บางทีเขาอาจจะไม่ปฏิวัติก็ได้" - เขตรัฐ #รวมพลังประชาชาติไทย ... แดกจุด นี่มืงคิดซักนิดก่อนพูดยัง ละจะ #เลือกตั้ง62 ทำควยไร";;;#รวมพล #เล;"1098201707807272960";https://twitter.com/bkparque/status/1098201707807272960
;2019-02-20 19:40;0;1;"คุณเขตรัฐ #รวมพลังประชาชาติไทย เปิดปากมาแต่ละคำใน #ถามตรงๆ คือดูโง่มาก ไม่ฟังด้วย เชี่ย สงสารคนแบบนี้อะ อายแทน พอๆกับที่กุสงสารหลานไพบูลย์อะ 55555 #เลือกตั้ง62 แม่งเป็นโฆษกด้วยนะ สมเพช 55555";;;#รวมพล #ถามตรงๆ #เล;"1098200740055535616";https://twitter.com/bkparque/status/1098200740055535616
;2019-02-20 17:10;0;0;"ประเด็นของชาวบ้านคือการใช้งบประมาณให้เกิดประสิทธิภาพสูงสุด ไม่ใช่ซื้อของห่วยในราคาแพง หรือตั้งนายพลไว้นั่งตบยุงรอวันเกษียณ #เลือกตั้ง #เลือกตั้ง62 #เลือกตั้ง2562 #เพื่อไทย #พลังประชารัฐ #ประชาธิปัตย์ #ภูมิใจไทย #อนาคตใหม่ #เสรีรวมไทย #รวมพลังประชาชาติไทย #งบกลาโหม #ปฏิรูปกองทัพ https:// twitter.com/Chu_SpringNews /status/1098161530254708737 …";;;#เล #เล #เล #เพ #พล #ประชาธ #ภ #อนาคตใหม #เสร #รวมพล #งบกลาโหม #ปฏ;"1098162896171819008";https://twitter.com/AsimBKK/status/1098162896171819008
;2019-02-20 13:01;3;2;"เมื่อ "ตำรวจ" ยังคงรับใช้ฝ่ายการเมืองและ หรือถูกใช้เป็นเครื่องมือทางการเมือง ชาวบ้านอย่างเราๆก็คงจะได้แต่ฝันถึง "นิติรัฐ" #หนักเเผ่นดิน #ประเทศกูมี #เลือกตั้ง #เลือกตั้ง62 #เลือกตั้ง2562 #เพื่อไทย #พลังประชารัฐ #ประชาธิปัตย์ #ภูมิใจไทย #อนาคตใหม่ #เสรีรวมไทย #รวมพลังประชาชาติไทย https:// twitter.com/amarintvhd/sta tus/1098099416290840582 …";;;#หน #ประเทศก #เล #เล #เล #เพ #พล #ประชาธ #ภ #อนาคตใหม #เสร #รวมพล;"1098100241939611649";https://twitter.com/AsimBKK/status/1098100241939611649
;2019-02-20 12:55;0;0;"ที่ผ่านมา ปอท. ถูกใช้เป็นเครื่องมือทางการเมืองหรือไม่ #หนักเเผ่นดิน #ประเทศกูมี #เลือกตั้ง #เลือกตั้ง62 #เลือกตั้ง2562 #เพื่อไทย #พลังประชารัฐ #ประชาธิปัตย์ #ภูมิใจไทย #อนาคตใหม่ #เสรีรวมไทย #รวมพลังประชาชาติไทย #ประชาธิปไตย #ปฏิรูปตำรวจ #กฎหมายปิดปาก #ปอท #ThailandElection";;;#หน #ประเทศก #เล #เล #เล #เพ #พล #ประชาธ #ภ #อนาคตใหม #เสร #รวมพล #ประชาธ #ปฏ #กฎหมายป #ปอท #ThailandElection;"1098098853809541120";https://twitter.com/AsimBKK/status/1098098853809541120
;2019-02-20 12:16;4;2;"การใช้ "กฎหมายปิดปาก" ไม่เปิดพื้นที่ให้คนที่คิดต่าง เป็นการส่งเสริมบรรยากาศที่ดี ที่จะนำไปสู่การเลือกตั้งอย่างไร #หนักเเผ่นดิน #ประเทศกูมี #เลือกตั้ง #เลือกตั้ง62 #เลือกตั้ง2562 #เพื่อไทย #พลังประชารัฐ #ประชาธิปัตย์ #ภูมิใจไทย #อนาคตใหม่ #เสรีรวมไทย #รวมพลังประชาชาติไทย https:// twitter.com/ThaiPBSNews/st atus/1098087327082078208 …";;;#หน #ประเทศก #เล #เล #เล #เพ #พล #ประชาธ #ภ #อนาคตใหม #เสร #รวมพล;"1098088985052626945";https://twitter.com/AsimBKK/status/1098088985052626945
;2019-02-20 12:07;0;3;"ลิงค์สำหรับคนที่สนใจจ้า ลงทะเบียนเข้าร่วมงานที่ลิ้งค์ด้านล่าง https:// docs.google.com/forms/d/1e0oGP PPErtFOiOqdDzt7Y61FV1n5fu8zVDzigP7cY-w … #เสวนาการเลือกตั้ง #อนาคตใหม่ #รวมพลังประชาชาติไทย #ประชาธิปัตย์ #เพื่อไทย #ภูมิใจไทย";;;#เสวนาการเล #อนาคตใหม #รวมพล #ประชาธ #เพ #ภ;"1098086698645221376";https://twitter.com/Kathyqqqz/status/1098086698645221376
