username;date;retweets;favorites;text;geo;mentions;hashtags;id;permalink
;2018-12-30 22:25;5;7;"บรรยากาศการทำไพรมารีโหวต ผู้สมัคร เขต 5 จ.สุราษฎร์ธานี ได้คุณปรีติ เชาวลิตร (สจ.ปิ๊ก) เป็นผู้สมัครในนามพรรคพร้อมแรงสนับสนุนจากประชาชนในพื้นที่ชูธงคนรุ่นใหม่ปฏิรูปประเทศไทย #รวมพลังประชาชาติไทย pic.twitter.com/XgzEQKnTnW";;;#รวมพล;"1079398052153065473";https://twitter.com/ACTPARTYORG/status/1079398052153065473
;2018-12-30 19:52;7;18;"บรรยากาศการทำไพรมารีโหวต จ.นครปฐม ได้ผู้สมัครครบทั้ง 4 เขต #รวมพลังประชาชาติไทย pic.twitter.com/9hd5ynJk5v";;;#รวมพล;"1079359574539350016";https://twitter.com/ACTPARTYORG/status/1079359574539350016
;2018-12-30 15:50;8;19;"ดร.สุริยะใส กตะศิลา คุณวีระชัย คล้ายทอง และผู้ร่วมก่อตั้งพรรคอีกหลายท่านไปร่วมไพรมารีโหวต ผู้สมัคร สส.จังหวัดนนทบุรี ได้ครบทั้ง 6 เขต พร้อมลุยเลือกตั้งสานฝันปฏิรูป #รวมพลังประชาชาติไทย pic.twitter.com/fBaXW3r5gE";;;#รวมพล;"1079298604756480001";https://twitter.com/ACTPARTYORG/status/1079298604756480001
;2018-12-29 21:00;7;9;"ลพบุรีพร้อม! รศ.ดร.จักษ์ พันธ์ชูเพชร กกบ.พรรคเดินสายเปิดสำนักงานตัวแทนพรรคในแต่ละเขต พร้อมทั้งทำไพรมารีโหวตทุกเขตไปพร้อมๆกัน ที่ จ.ลพบุรี วันนี้ได้ผู้สมัครครบทั้ง 4 เขต #รวมพลังประชาชาติไทย pic.twitter.com/kict78j0Ee";;;#รวมพล;"1079014243792388096";https://twitter.com/ACTPARTYORG/status/1079014243792388096
;2018-12-27 20:21;5;13;"เก็บตกบรรยากาศ #เดินคารวะแผ่นดิน ที่สมุทรสาคร #รวมพลังประชาชาติไทย pic.twitter.com/VVnUI0NzSc";;;#เด #รวมพล;"1078279811125075969";https://twitter.com/ACTPARTYORG/status/1078279811125075969
;2018-12-26 16:41;6;12;"ดร.จักษ์ พันธ์ชูเพชร กกบ.พรรคไปร่วมเป็นสักขีพยานไพรมารีโหวตผู้สมัคร สส. และเปิดสำนักงานตัวแทนพรรคประจำจังหวัดกำแพงเพชร #รวมพลังประชาชาติไทย pic.twitter.com/kgfB4t7Mbl";;;#รวมพล;"1077861973763604480";https://twitter.com/ACTPARTYORG/status/1077861973763604480
;2018-12-25 20:06;5;17;"พลังประชาชน...พลังขับเคลื่อนการเมือฝไทย #รวมพลังประชาชาติไทย pic.twitter.com/xbUZp0kYKD";;;#รวมพล;"1077551031427289090";https://twitter.com/ACTPARTYORG/status/1077551031427289090
;2018-12-24 19:17;5;17;"บทพิสูจน์อุดมการณ์ที่แน่วแน่...พรรคการเมืองของประชาชนที่แท้จริง #คนธรรมดาสร้างชาติ #รวมพลังประชาชาติไทย pic.twitter.com/gLdEWWHOfi";;;#คนธรรมดาสร #รวมพล;"1077176389877395457";https://twitter.com/ACTPARTYORG/status/1077176389877395457
;2018-12-23 17:16;7;18;"ก้าวย่างสู่ประชาธิปไตย...ด้วยพรรคการเมืองของประชาชนที่แท้จริง #รวมพลังประชาชาติไทย pic.twitter.com/58Y6qciKiw";;;#รวมพล;"1076783600765329408";https://twitter.com/ACTPARTYORG/status/1076783600765329408
;2018-12-23 09:41;8;20;"ตลาดสดเทศบาล3 อุบลราชธานี #เดินคารวะแผ่นดิน เป็นวันที่ 2 ที่ จ.อุบลฯ #คนธรรมดาสร้างชาติ #รวมพลังประชาชาติไทย pic.twitter.com/CBtg4Yx3FW";;;#เด #คนธรรมดาสร #รวมพล;"1076669041715044357";https://twitter.com/ACTPARTYORG/status/1076669041715044357
;2018-12-21 17:39;8;25;"เก็บตกคารวะแผ่นดิน จ.ศรีสะเกษ #รวมพลังประชาชาติไทย pic.twitter.com/xk6s5Qj0jb";;;#รวมพล;"1076064636972093441";https://twitter.com/ACTPARTYORG/status/1076064636972093441
;2018-12-20 19:51;0;1;"“เพื่อไทย” จ่อปูเสื่อระดมทุนประชดโต๊ะจีนร้อยล้าน “พลังประชารัฐ” https://www. pptvhd36.com/news/95297 #PPTVHD36 #PPTVNews #พลังประชารัฐ #เพื่อไทย #ระดมทุน #รวมพลังประชาชาติไทย";;;#PPTVHD36 #PPTVNews #พล #เพ #ระดมท #รวมพล;"1075735348288733185";https://twitter.com/PPTVHD36/status/1075735348288733185
;2018-12-20 12:28;14;31;"ชาวสุรินทร์ ต้อนรับลุงกำนัน และฝากให้เดินหน้าปฏิรูปประเทศไทย สร้างพรรคการเมืองของประชาชนที่แท้จริง #รวมพลังประชาชาติไทย pic.twitter.com/HEVn28dTtu";;;#รวมพล;"1075623919111917569";https://twitter.com/ACTPARTYORG/status/1075623919111917569
;2018-12-20 08:29;13;28;"สุรินทร์แล้ว! ชาวเมืองช้าง ออกมาต้อนรับลุงกำนัน #เดินคารวะแผ่นดิน ที่ตลาดเทศบาลสุรินทร์ วันนี้ทั้งวันจะพบปะเชิญชวนพี่น้องชาวเมืองช้างร่วมสนับสนุนและเป็นสมาขิกพรรค #รวมพลังประชาชาติไทย pic.twitter.com/96W7ybDIed";;;#เด #รวมพล;"1075563900534284288";https://twitter.com/ACTPARTYORG/status/1075563900534284288
;2018-12-19 18:02;9;31;"พี่น้องชาว จ.บุรีรัมย์ ออกมาต้อนรับลุงกำนันและคาราวานคารวะแผ่นดินคึกคัก หลายคนพร้อมสนับสนุนพรรครวมพลังประชาชาติไทย เพราะยังมั่นใจในตัวลุงกำนัน และแนวทางพรรคที่เป็นพรรคการเมืองของประชาชนอย่างแท้จริง #รวมพลังประชาชาติไทย pic.twitter.com/OS5D2IQ2Rq";;;#รวมพล;"1075345554064924672";https://twitter.com/ACTPARTYORG/status/1075345554064924672
;2018-12-19 10:43;11;35;"บุรีรัมย์แล้ว! วันนี้ทั้งวันลุงกำนันเดินคารวะแผ่นดินเป็นจังหวัดที่ 2 ของภาคอีสานต่อจากนครราขสีมา การต้อนรับอบอุ่นไม่แพ้จังหวัดใด #คนธรรมดาสร้างชาติ #รวมพลังประชาชาติไทย pic.twitter.com/am6SuKQe1t";;;#คนธรรมดาสร #รวมพล;"1075235226866016257";https://twitter.com/ACTPARTYORG/status/1075235226866016257
;2018-12-18 21:56;6;10;"ลุงกำนันสุเทพย้ำ ! ประเทศไทยถึงเวลาที่ต้องมีพรรคการเมืองของประชาชนที่แท้จริง พรรค รปช.ตั้งขึ้นมาจากคนที่มีอุดมการณ์เดียวกัน เพื่อรักษาและปกป้องผลประโยชน์ของชาติและประชาชน #คนธรรมดาสร้างชาติ #รวมพลังประชาชาติไทย pic.twitter.com/kEqiaQ0FKc";;;#คนธรรมดาสร #รวมพล;"1075042226491793411";https://twitter.com/ACTPARTYORG/status/1075042226491793411
;2018-12-18 20:04;7;14;"“รปช” รวมพลังประชาชาติไทย นำโดย ม.ร.ว.จัตตุมงคล โสณกุล หัวหน้าพรรค เปิดงานกาล่าดินเนอร์ ที่ศูนย์ประชุมแห่งชาติสิริกิติ์ เพื่อระดมทุนเข้าพรรค ภายใต้คอนเซ็ปต์ “ทุติยบท” ภาคสองของการปฏิรูปประเทศ #คนธรรมดาสร้างชาติ #รวมพลังประชาชาติไทย pic.twitter.com/hgIbIz1wto";;;#คนธรรมดาสร #รวมพล;"1075013816063152129";https://twitter.com/ACTPARTYORG/status/1075013816063152129
;2018-12-17 16:03;6;11;"ตลาดหลักเมือง โคราช! ชาวบ้าน หาเช้ากินค่ำ ต่างมีความหวังกับการเลือกตั้งที่จะมาถึง ฝากลุงกำนันและพรรค รปช.แก้ปัญหาปากท้อง และการปฏิรูปประเทศ ที่ยังเป็นงานที่ทำไม่เสร็จ #รวมพลังประชาชาติไทย pic.twitter.com/luD4PsZedg";;;#รวมพล;"1074590872430211072";https://twitter.com/ACTPARTYORG/status/1074590872430211072
;2018-12-15 12:29;0;1;"“สุเทพ” อุ้ม “ประยุทธ์” 4 รมต. พลังประชารัฐ ไม่ต้องลาออก https://www. pptvhd36.com/news/94976 #PPTVHD36 #PPTVNews #ข่าววันนี้ #สุเทพเทือกสุบรรณ #รวมพลังประชาชาติไทย #ประยุทธ์จันทร์โอชา #พลังประชารัฐ #ไม่ต้องลาออก";;;#PPTVHD36 #PPTVNews #ข #ส #รวมพล #ประย #พล #ไม;"1073812333170835456";https://twitter.com/PPTVHD36/status/1073812333170835456
;2018-12-15 12:10;0;0;"รปช. ประชุม 8 จังหวัดภาคเหนือตอนบน เปิดตัวว่าที่ผู้สมัคร ส.ส.เชียงใหม่ 9 เขต #รวมพลังประชาชาติไทย #เลือกตั้ง #มติชนออนไลน์ #มติชนการเมือง https://www. matichon.co.th/politics/news_ 1273563 …";;;#รวมพล #เล #มต #มต;"1073807565580988418";https://twitter.com/MatichonOnline/status/1073807565580988418
;2018-12-14 20:01;9;17;"17 ศูนย์เพื่อสมัชชาใหญ่ ทั่วประเทศพร้อมแล้วสำหรับการประชุมใหญ่พรุงนี้ #รวมพลังประชาชาติไทย pic.twitter.com/BreD08ZNu1";;;#รวมพล;"1073563743747895297";https://twitter.com/ACTPARTYORG/status/1073563743747895297
;2018-12-13 20:57;4;16;"วันนี้ นายทวีศักดิ์ ณ ตะกั่วทุง เลขาธิการพรรค และ ดร.จักษ์ พันธ์ชูเพชร ผู้ร่วมจัดตั้งพรรค ไปร่วมพิธีเปิดสาขาพรรค ที่ จ.พิษณุโลก #รวมพลังประชาชาติไทย pic.twitter.com/7nlZaeePj0";;;#รวมพล;"1073215449045774337";https://twitter.com/ACTPARTYORG/status/1073215449045774337
;2018-12-12 10:06;11;28;"กปปส.สระบุรีพรึ่บ! ต้อนรับ #เดินคารวะแผ่นดิน อย่างคึกคัก นกหวีด ภาพถ่าย ธงชาติไทย สมัยต่อสู้ของมวลทหาประชาชน ถูกโบกสะบัดรับลุงกำนัน อีกครั้ง #รวมพลังประชาชาติไทย จ.สระบุรี pic.twitter.com/dJcYoKCCJa";;;#เด #รวมพล;"1072689075826511872";https://twitter.com/ACTPARTYORG/status/1072689075826511872
;2018-12-10 20:42;9;24;"เก็บตกบรรยากาศ #เดินคารวะแผ่นดิน ที่ จ.ลพบุรี พรุ่งนี้พบกันที่ จ.อ่างทอง #รวมพลังประชาชาติไทย pic.twitter.com/S0fr9kGdbP";;;#เด #รวมพล;"1072124514702479361";https://twitter.com/ACTPARTYORG/status/1072124514702479361
;2018-12-10 11:51;11;25;"ก้าวที่กล้าสู่การปฏิรูปประเทศ! คาราวาน #เดินคารวะแผ่นดิน พบปะพี่น้องชาว จ.ลพบุรี เพื่อแนะนำพรรคของประชาชนและเชิญชวนพี่น้องประชาชนมาร่วมกันเป็นเจ้าของพรรค #รวมพลังประชาชาติไทย pic.twitter.com/LC6AjWYWNL";;;#เด #รวมพล;"1071990823317716992";https://twitter.com/ACTPARTYORG/status/1071990823317716992
;2018-12-08 16:05;4;1;"มี 88 พรรคการเมืองให้เลือกกัล บอกเลยมีแค่11พรรคเท่านั้นที่มีสส.ในสภา = #เพื่อไทย , #ประชาธิปัตย์ , #พลังประชารัฐ , #ไทยรักษาชาติ , #อนาคตใหม่ , #ชาติไทยพัฒนา , #ชาติพัฒนา , #ประชาชาติ , #รวมพลังประชาชาติไทย , #เพื่อชาติ , #ประชาชนปฏิรูป #เลือกตั้ง62 #ElectionThailand #พรรคการเมือง #อนาคตใหม่ pic.twitter.com/1Vm2ceareA";;;#เพ #ประชาธ #พล #ไทยร #อนาคตใหม #ชาต #ชาต #ประชาชาต #รวมพล #เพ #ประชาชนปฏ #เล #ElectionThailand #พรรคการเม #อนาคตใหม;"1071330035380903936";https://twitter.com/BallAntiCoup/status/1071330035380903936
;2018-12-06 16:34;5;21;"พี่น้องชาวสมุย ต้อนรับลุงกำนันและทีมงานคารวะแผ่นดิน พร้อมทั้งสนใจสมัครสมาชิกพรรคและสนับสนุนพรรคการเมืองของประชาชนจำนวนมาก #รวมพลังประชาชาติไทย pic.twitter.com/9Eg0BnRffl";;;#รวมพล;"1070612429795549184";https://twitter.com/ACTPARTYORG/status/1070612429795549184
;2018-12-04 18:36;3;9;"เก็บตกบรรยากาศ #เดินคารวะแผ่นดิน ที่ จ.สิงห์บุรี #รวมพลังประชาชาติไทย pic.twitter.com/CDRByREdoL";;;#เด #รวมพล;"1069918342218010625";https://twitter.com/ACTPARTYORG/status/1069918342218010625
;2018-12-04 16:51;7;14;"จบภารกิจ #เดินคารวะแผ่นดิน ที่ จ.สิงห์บุรีแล้ว ขอบคุณพี่น้องประชาชนที่ให้การต้อนรับเป็นอย่างดี หวังว่าจะได้พบกันอีกเร็วๆ นี้ #รวมพลังประชาชาติไทย pic.twitter.com/QaMInJT8Ns";;;#เด #รวมพล;"1069892026257170432";https://twitter.com/ACTPARTYORG/status/1069892026257170432
;2018-12-02 19:39;13;35;"เขตรัฐ เหล่าธรรมทัศน์ คนรุ่นใหม่ ที่มุ่งมั่นทำการเมืองแบบใหม่ อีกหนึ่งความภาคภูมิใจของ #รวมพลังประชาชาติไทย pic.twitter.com/fD4GaJqFyK";;;#รวมพล;"1069209359853309952";https://twitter.com/ACTPARTYORG/status/1069209359853309952
;2018-12-02 15:56;7;10;"ดร.สุริยะใส กตะศิลา ผู้ร่วมจัดตั้งพรรค มาร่วมกิจกรรมและแลกเปลี่ยนเรียนรู้กับสโมสรเยาวชน Act youth ในโครงการ “คนรุ่นใหม่หัวใจพอเพียง “ #รวมพลังประชาชาติไทย #คนรุ่นใหม่หัวใจพอเพียง pic.twitter.com/hMLnjIXq9N";;;#รวมพล #คนร;"1069153209275432998";https://twitter.com/ACTPARTYORG/status/1069153209275432998
;2018-12-02 11:31;12;22;"คนรุ่นใหม่หัวใจพอเพียง Act youth รปช.ลงทำกิจกรรมและเรียนรู้เกษตรพอเพียง ตามแนวทางศาสตร์พระราชา ที่สวนผักชานเมือง บางแคกทม. #รวมพลังประชาชาติไทย pic.twitter.com/AaR1TTWeFf";;;#รวมพล;"1069086580122386434";https://twitter.com/ACTPARTYORG/status/1069086580122386434
;2018-12-01 10:49;8;13;"พรรครวมพลังประชาชาติไทย (รปช.) ขอเชิญสมาชิกพรรคทุกท่านประชุมใหญ่สามัญ ครั้งที่ 2/2561 วันที่ 15 ธันวาคม เปิดจุดประชุมพร้อมกั่นทั่วประเทศ กว่า 20 จุด ถือเป็นการสร้างประวัติศาสตร์หน้าใหม่การเมืองไทย ที่สมาชิกร่วมประชุมและร่วมโหวตได้โดยตรง #รวมพลังประชาชาติไทย pic.twitter.com/oRXBMFvIMe";;;#รวมพล;"1068713781331582976";https://twitter.com/ACTPARTYORG/status/1068713781331582976
;2018-11-28 16:22;8;24;"คนรุ่นใหม่ใน รปช.คิดอะไร! งานเสวนา “อนาคตประเทศไทย” จัดโดยองค์การนักศึกษา ม.รามคำแหง มีตัวแทนคนรุ่นใหม่ในพรรค ทั้ง ดร.จักษ์ พันธ์ชูเพชร อุทัย ยอดมณี เขตรัฐ เหล่าธรรมทัศน์ และเพชรชมพู กิจบูรณะ ร่วมเสวนา มี นศ.เข้าร่วมรับฟังคับคั่งวันนี้ #รวมพลังประชาชาติไทย pic.twitter.com/d43MowJ8be";;;#รวมพล;"1067710320670474241";https://twitter.com/ACTPARTYORG/status/1067710320670474241
;2018-11-28 14:17;9;23;"วันนี้ ศ.(พิเศษ) ดร.เอนก เหล่าธรรมทัศน์ ผู้ร่วมจัดตั้งพรรคไปร่วมแสดงวิสัยทัศน์ที่สถานีโทรทัศน์ไทยพีบีเอส ในหัวข้อ “การสร้างคนไทยสู่ศตวรรษที่ 21” #รวมพลังประชาชาติไทย pic.twitter.com/vRhgK2a952";;;#รวมพล;"1067678926963585024";https://twitter.com/ACTPARTYORG/status/1067678926963585024
;2018-11-28 13:15;1;4;"รปช.เรียกร้อง คสช.ปลดล็อกทางการเมือง http:// news.thaipbs.or.th/content/275986 #ThaiPBSnews #ไทยพีบีเอส #รวมพลังประชาชาติไทย #ประชาธิปัตย์";;;#ThaiPBSnews #ไทยพ #รวมพล #ประชาธ;"1067663229508182016";https://twitter.com/ThaiPBSNews/status/1067663229508182016
;2018-11-26 09:25;10;22;"มรว.จัตุมงคล โสณกุล หัวหน้าพรรคและคุณทวีศักดิ์ ณ ตะกั่วทุ่ง เลขาธิการพรรค ไปรับสมัครสมาชิกพรรคที่ จ.เชียงใหม่ ได้รับการต้อนรับอย่างอบอุ่นและมีผู้สมัครสมาชิกพรรคนับร้อยคน #รวมพลังประชาชาติไทย pic.twitter.com/ZzVvwbpRbl";;;#รวมพล;"1066880573698846720";https://twitter.com/ACTPARTYORG/status/1066880573698846720
;2018-11-24 15:09;0;3;"“สุเทพ” เผยไม่ลำบากใจ “ชุมพล” ถูก ปชป.ห้ามต้อนรับ ชี้ตนมีเพื่อนเยอะ! https://www. pptvhd36.com/news/93775 #PPTVHD36 #PPTVNews #สุเทพเทือกสุบรรณ #ชุมพลจุลใส #รวมพลังประชาชาติไทย #ประชาธิปัตย์";;;#PPTVHD36 #PPTVNews #ส #ช #รวมพล #ประชาธ;"1066242483141586945";https://twitter.com/PPTVHD36/status/1066242483141586945
;2018-11-23 16:46;11;30;"เข้าร่วมอุดมการณ์! นายสุรเชษฐ์ แวอาแซ นายรำรี มามะ และนายอับดุล การีม เต็งกะรีนา อดีต สส. นราธิวาสและยะลา เข้าร่วมสมัครเป็นสมาชิกพรรค รปช.เพราะเชื่อมั่นแนวทางและอุดมการณ์พรรค #รวมพลังประชาชาติไทย pic.twitter.com/ZRW9q7petL";;;#รวมพล;"1065904492179185664";https://twitter.com/ACTPARTYORG/status/1065904492179185664
;2018-11-22 14:28;1;2;"สวัสดีตอนบ่ายครับพี่น้องทุกท่านผมขอเชิญชวนพี่น้องทุกท่านมา #รวมพลังประชาชาติไทย ...ไปด้วยกันนะครับ #ร่วมกันเราทำได้ .... pic.twitter.com/iNeHkc1Vx8";;;#รวมพล #ร;"1065507337991942144";https://twitter.com/YodmaneeUthai/status/1065507337991942144
;2018-11-22 09:23;9;26;"เช้านี่ที่ภูเก็ต! ลุงกำนันยังคงเดินด้วยความเร็วสม่ำเสมอ แรงไม่ตก เช่นเดียวกับกำลังใจและแรงสนับสนุนจากพี่น้องประชาชนชาวปักษ์ใต้ #เดินคารวะแผ่นดิน #รวมพลังประชาชาติไทย pic.twitter.com/qoGJm4qdzq";;;#เด #รวมพล;"1065430566378434560";https://twitter.com/ACTPARTYORG/status/1065430566378434560
;2018-11-21 16:16;3;1;"มาร์ค แถลงผลประชุมคณะกรรมการบริหาร #พรรคประชาธิปัตย์ ไม่ลงโทษ ถาวร-วิทยา ร่วมทำกิจกรรมสุเทพ #รวมพลังประชาชาติไทย แต่ยอมรับไม่เหมาะสม พร้อมออกกฎใครทำซ้ำไม่ส่งเลือกตั้ง-ขับออกจากพรรค ยอมรับในพรรคมีระเบิดเวลาแต่ยังคุมสภาพได้ https:// youtu.be/8J352E69Y3o #PK pic.twitter.com/RgcSFyof5r";;;#พรรคประชาธ #รวมพล #PK;"1065172131187580928";https://twitter.com/Pimnara_pk/status/1065172131187580928
